{
  "$schema": "https://json-schema.org/draft/2020-12",
  "$id": "mpp/patterns/PATTERN_SCHEMA.json",
  "title": "MetaBlooms Failure Pattern Card",
  "description": "Schema for a single failure pattern card in the MPP pattern library. Every field is required except countermeasures (minimum 1) and sources (minimum 1).",
  "type": "object",
  "required": [
    "id",
    "name",
    "class",
    "status",
    "tags",
    "trigger_shapes",
    "activation",
    "mechanism",
    "signal_sequence",
    "lag",
    "threshold_estimated",
    "invisible_because",
    "diagnostic",
    "countermeasures",
    "sources",
    "discovered",
    "last_reviewed"
  ],
  "additionalProperties": false,
  "properties": {
    "id": {
      "type": "string",
      "pattern": "^[A-Z][A-Z0-9_]+$",
      "description": "Stable, unique identifier in SCREAMING_SNAKE_CASE. Never reuse or rename after first commit."
    },
    "name": {
      "type": "string",
      "minLength": 10,
      "description": "Human-readable pattern name. Descriptive, not jargon."
    },
    "class": {
      "type": "string",
      "enum": ["architectural", "operational", "data", "security", "concurrency"],
      "description": "The system layer where this pattern originates."
    },
    "status": {
      "type": "string",
      "enum": ["DRAFT", "ACTIVE", "DEPRECATED"],
      "description": "DRAFT = under review. ACTIVE = validated and committed. DEPRECATED = superseded."
    },
    "tags": {
      "type": "array",
      "items": { "type": "string" },
      "minItems": 1,
      "description": "Search tags for retrieval. Include technology names, failure modes, and affected layers."
    },
    "trigger_shapes": {
      "type": "array",
      "items": { "type": "string" },
      "minItems": 1,
      "description": "Code or architecture shapes that should trigger checking this pattern. Plain English. E.g. 'retry loop around an external API call'."
    },
    "activation": {
      "type": "string",
      "minLength": 50,
      "description": "The specific condition that starts the failure. What is the precipitating event?"
    },
    "mechanism": {
      "type": "string",
      "minLength": 100,
      "description": "Step-by-step causal chain from activation to customer impact. Each step must follow from the prior one."
    },
    "signal_sequence": {
      "type": "array",
      "minItems": 4,
      "items": {
        "type": "object",
        "required": ["phase", "signal"],
        "additionalProperties": false,
        "properties": {
          "phase": {
            "type": "string",
            "enum": ["invisible", "first_anomaly", "escalation", "customer_impact"]
          },
          "signal": {
            "type": "string",
            "minLength": 20,
            "description": "What is visible (or invisible) at this phase. Specific enough to configure an alert on."
          }
        }
      },
      "description": "Ordered phases of signal visibility from initial failure to full customer impact."
    },
    "lag": {
      "type": "string",
      "description": "Estimated time from activation to customer-visible impact. E.g. 'seconds', 'minutes', 'hours', 'days'."
    },
    "threshold_estimated": {
      "type": "string",
      "minLength": 20,
      "description": "The approximate load, rate, or condition at which this pattern typically activates. Include reasoning."
    },
    "invisible_because": {
      "type": "string",
      "minLength": 50,
      "description": "The specific reason standard monitoring and alerting does not catch this early. Why does it look OK when it isn't?"
    },
    "diagnostic": {
      "type": "string",
      "minLength": 30,
      "description": "The concrete question or query an engineer runs to confirm or rule out this pattern. Specific enough to execute."
    },
    "countermeasures": {
      "type": "array",
      "items": { "type": "string", "minLength": 20 },
      "minItems": 1,
      "description": "Concrete actions that prevent or mitigate this pattern. Each is actionable, not advisory."
    },
    "sources": {
      "type": "array",
      "minItems": 1,
      "items": {
        "type": "object",
        "required": ["title", "type"],
        "additionalProperties": false,
        "properties": {
          "title": { "type": "string" },
          "url":   { "type": "string" },
          "type":  {
            "type": "string",
            "enum": ["postmortem", "engineering-blog", "documentation", "research", "book"]
          }
        }
      },
      "description": "Evidence sources. At least one must be a postmortem or engineering-blog."
    },
    "discovered": {
      "type": "string",
      "pattern": "^\\d{4}-\\d{2}-\\d{2}$",
      "description": "ISO 8601 date when this pattern was first documented in this library."
    },
    "last_reviewed": {
      "type": "string",
      "pattern": "^\\d{4}-\\d{2}-\\d{2}$",
      "description": "ISO 8601 date of most recent review. Update whenever a source is added or a field is revised."
    },
    "cascades_to": {
      "type": "array",
      "items": { "type": "string", "pattern": "^[A-Z][A-Z0-9_]+$" },
      "description": "IDs of patterns that commonly follow this one once it manifests. Drives the failure dependency graph. Order is not significant."
    },
    "misdiagnosis": {
      "type": "array",
      "items": { "type": "string", "minLength": 20 },
      "description": "Plausible but wrong hypotheses an on-call engineer reaches before correctly identifying this pattern. Each entry is a specific wrong conclusion and why it is reached."
    },
    "recovery_cost": {
      "type": "object",
      "additionalProperties": false,
      "description": "Estimated cost to diagnose and recover, with and without the card.",
      "properties": {
        "time_without_card":   { "type": "string" },
        "time_with_card":      { "type": "string" },
        "blast_radius":        { "type": "string" },
        "data_integrity_risk": { "type": "string", "enum": ["low", "medium", "high", "critical"] },
        "financial_risk":      { "type": "string", "enum": ["low", "medium", "high", "critical"] }
      }
    },
    "alert_metadata": {
      "type": "object",
      "description": "Optional. Machine-readable alert parameters for the alert generator. Cards without this field produce FILL_IN templates. Cards with metric_category=data_consistency produce explanatory comments instead of metric alerts.",
      "required": ["metric_category", "condition_type"],
      "additionalProperties": false,
      "properties": {
        "metric_category": {
          "type": "string",
          "enum": ["queue_depth", "consumer_lag", "error_rate", "latency", "data_consistency"],
          "description": "The class of observable signal. data_consistency means no time-series alert is possible — a reconciliation job is required instead."
        },
        "condition_type": {
          "type": "string",
          "enum": ["sustained", "spike"],
          "description": "sustained: condition must persist before alerting (use for: duration). spike: condition may clear instantly (use for: 0s)."
        },
        "prometheus": {
          "type": "object",
          "description": "Prometheus-specific alert parameters. Omit for data_consistency patterns.",
          "required": ["metric_hint", "threshold_value", "threshold_unit", "comparison", "for_duration", "severity"],
          "additionalProperties": false,
          "properties": {
            "metric_hint": {
              "type": "string",
              "description": "A PromQL metric name or selector fragment. Must not contain comparison operators or boolean literals. The generator validates this before rendering.",
              "minLength": 3
            },
            "threshold_value": {
              "type": "number",
              "exclusiveMinimum": 0,
              "description": "The numeric threshold at which the alert fires. Must be positive."
            },
            "threshold_unit": {
              "type": "string",
              "enum": ["messages_per_hour", "ratio", "seconds", "milliseconds", "count"],
              "description": "Unit of the threshold value. Used in alert annotations for human readability."
            },
            "comparison": {
              "type": "string",
              "enum": ["gt", "lt", "gte", "lte"],
              "description": "Comparison operator: gt=greater than, lt=less than, gte/lte=inclusive."
            },
            "for_duration": {
              "type": "string",
              "pattern": "^[0-9]+(s|m|h)$",
              "description": "Prometheus for: duration. How long the condition must be true before alerting. E.g. '5m', '30s', '1h'."
            },
            "severity": {
              "type": "string",
              "enum": ["warning", "critical"],
              "description": "Alert severity label. critical = page immediately. warning = ticket or Slack."
            }
          }
        }
      }
    }
  }
}
